index,NAIC Code ,Company Name ,Calendar Year ,Net Premiums Written
8566,36650,GUARANTEE CO OF N AMER USA,2005,348850
8567,11398,GUARANTEE INS CO,2005,635492
8568,11401,Guaranty Natl Ins Co,2005,91281
8569,42803,GUIDEONE ELITE INS CO,2005,3787308
8570,15032,GUIDEONE MUT INS CO,2005,13098364
8571,14559,GUIDEONE SPECIALTY MUT INS CO,2005,9438452
8572,28630,GUILDERLAND REINS CO,2005,15858
8573,42811,GULF UNDERWRITERS INS CO,2005,127523
8574,22292,HANOVER INS CO,2005,82299333
8575,31224,HANYS MEMBER HOSP SELF INS TRUST,2005,16288470
8576,26433,HARCO NATL INS CO,2005,8556408
8577,33235,Harleysville Ins Co of NY ,2005,108849197
8578,26182,HARLEYSVILLE WORCESTER INS CO,2005,142152245
8579,22357,HARTFORD ACCIDENT & IND CO,2005,50744416
8580,29424,HARTFORD CAS INS CO,2005,76969715
8581,19682,HARTFORD FIRE IN CO,2005,263168955
8582,38288,HARTFORD INS CO OF IL,2005,44294522
8583,37478,HARTFORD INS CO OF THE MIDWEST,2005,127391061
8584,11452,HARTFORD STEAM BOIL INSPEC & INS CO,2005,16519926
8585,29890,HARTFORD STEAM BOIL INSPEC INS CO CT,2005,1409
8586,16535,ZURICH AMER INS CO,2005,473527629
8587,30104,HARTFORD UNDERWRITERS INS CO,2005,31325194
8588,41343,HDI GERLING AMER INS CO,2005,5774241
8589,24309,HEREFORD INS CO,2005,76017957
8590,39527,HERITAGE IND CO,2005,2442249
8591,18376,HERMITAGE INS CO ,2005,17403628
8592,10200,HISCOX INS CO INC,2005,681149
8593,14206,HOLYOKE MUT INS CO IN SALEM,2005,3241865
8594,34452,HOMELAND INS CO OF NY,2005,1553964
8595,10986,HOMESITE INS CO OF NY,2005,4205625
8596,22578,HORACE MANN INS CO,2005,462052
8597,30317,HOSPITALS INS CO INC,2005,60504628
8598,25054,HUDSON INS CO,2005,38132079
8599,37079,HUDSON SPECIALTY INS CO,2005,1477774
8600,23817,ILLINOIS NATL INS CO,2005,525162168
8601,35408,IMPERIUM INS CO,2005,111809358
8602,43575,INDEMNITY INS CO OF NORTH AMER,2005,107199097
8603,14265,INDIANA LUMBERMENS MUT INS CO,2005,143158
8604,39497,INFINITY ASSUR INS CO,2005,42002
8605,20583,XL REINS AMER INC,2005,594
8606,11738,INFINITY AUTO INS CO,2005,234720
8607,21792,INFINITY CAS INS CO,2005,482950
8608,22268,INFINITY INS CO,2005,1648465
8609,16802,INFINITY SAFEGUARD INS CO,2005,477977
8610,38873,INFINITY SECURITY INS CO,2005,1847843
8611,20260,INFINITY SELECT INS CO,2005,866517
8612,31925,INFINITY SPECIALTY INS CO,2005,204497
8613,12599,INFINITY STANDARD INS CO,2005,11309585
8614,22195,INSURANCE CO OF GREATER NY,2005,53021920
8615,22713,INSURANCE CO OF N AMER,2005,11347619
8616,19429,INSURANCE CO OF THE STATE OF PA,2005,128141965
8617,18341,Insurance Corp Of NY,2005,306625
8618,27930,INTEGON CAS INS CO,2005,2080529
8619,29742,INTEGON NATL INS CO,2005,42428741
8620,31488,INTEGON PREFERRED INS CO,2005,3531052
8621,14311,INTERBORO INS CO,2005,21449063
8622,11592,INTERNATIONAL FIDELITY INS CO,2005,4213183
8623,14354,JEWELERS MUT INS CO,2005,12030294
8624,10914,KEMPER INDEPENDENCE INS CO,2005,285470
8625,10088,KENSINGTON INS CO,2005,1394448
8626,13668,KINGSTONE INS CO,2005,17633572
8627,26077,LANCER INS CO,2005,64456343
8628,35637,LANDMARK INS CO,2005,4429901
8629,37800,LEADING INS GRP INS CO LTD,2005,7218182
8630,10380,LEATHERSTOCKING COOP INS  CO,2005,5036231
8631,42404,LIBERTY INS CORP,2005,187982889
8632,19917,LIBERTY INS UNDERWRITERS INC,2005,62715614
8633,23035,LIBERTY MUT FIRE INS CO,2005,694090788
8634,23043,LIBERTY MUT INS CO,2005,177669376
8635,33855,LINCOLN GEN INS CO,2005,26186947
8636,10748,LIVINGSTON MUT INS CO,2005,5870400
8637,33600,LM INS CORP,2005,16901421
8638,10982,Long Island Ins Co,2005,6767698
8639,27138,LUMBERMENS CAS INS CO,2005,743940
8640,22977,LUMBERMENS MUT CAS CO,2005,2202489
8641,23108,LUMBERMENS UNDERWRITING ALLIANCE ,2005,391359
8642,30449,MADISON MUT INS CO,2005,4056313
8643,29939,MAIN ST AMER ASSUR CO,2005,43096579
8644,36897,MANUFACTURERS ALLIANCE INS CO,2005,6643047
8645,28932,MARKEL AMER INS CO,2005,7385724
8646,38970,MARKEL INS CO,2005,53293193
8647,19356,MARYLAND CAS CO,2005,21327474
8648,22306,MASSACHUSETTS BAY INS CO,2005,70024851
8649,12041,MBIA INS CORP,2005,320404676
8650,34231,MEDICAL LIAB MUT INS CO,2005,629228901
8651,22241,MEDMARC CAS INS CO,2005,873777
8652,11030,MEMIC IND CO,2005,84814
8653,31968,MERASTAR INS CO,2005,1950760
8654,23329,MERCHANTS MUT INS CO,2005,90770936
8655,11908,MERCURY CAS CO,2005,31704252
8656,24821,MERITPLAN INS CO,2005,4469510
8657,19798,MERRIMACK MUT FIRE INS CO,2005,42210098
8658,40169,METROPOLITAN CAS INS CO,2005,143519938
8659,39950,METROPOLITAN GEN INS CO,2005,4463881
8660,34339,METROPOLITAN GRP PROP & CAS INS CO,2005,82375966
8661,26298,METROPOLITAN PROP & CAS INS CO,2005,114762122
8662,10682,MGIC CREDIT ASSUR CORP,2005,4984
8663,38601,MIC PROP & CAS INS CORP,2005,28603853
8664,14508,MICHIGAN MILLERS MUT INS CO,2005,10069321
8665,35866,MID HUDSON CO OPERATIVE INS CO,2005,6313520
8666,23434,MIDDLESEX INS CO,2005,70998
8667,14532,MIDDLESEX MUT ASSUR CO,2005,14077626
8668,26835,MIDROX INS CO,2005,4827395
8669,26818,MIDSTATE MUT INS CO,2005,11769909
8670,23612,MIDWEST EMPLOYERS CAS CO,2005,21213445
8671,23515,MIDWESTERN IND CO,2005,10658
8672,10811,MILLVILLE INS CO OF NY,2005,1321451
8673,20362,MITSUI SUMITOMO INS CO OF AMER,2005,21172525
8674,22551,MITSUI SUMITOMO INS USA INC,2005,9423232
8675,10382,MONROE COOP INS CO,2005,1438835
8676,29858,MORTGAGE GUAR INS CORP,2005,51707278
8677,13331,MOTORISTS COMMERCIAL MUT INS CO,2005,4271116
8678,22012,MOTORS INS CORP,2005,6244718
8679,26522,MOUNT VERNON FIRE INS CO,2005,1654123
8680,10205,MOUNTAIN VALLEY IND CO,2005,12170649
8681,23663,NATIONAL AMER INS CO,2005,199458
8682,11991,NATIONAL CAS CO,2005,70010508
8683,10243,NATIONAL CONTINENTAL INS CO,2005,8647966
8684,15679,NATIONAL FIRE & IND EXCH,2005,713103
8685,20478,NATIONAL FIRE INS CO OF HARTFORD,2005,52542368
8686,23728,NATIONAL GEN INS CO,2005,16057537
8687,44016,NATIONAL HOME INS CO RRG,2005,259951
8688,32620,NATIONAL INTERSTATE INS CO,2005,8057910
8689,20052,NATIONAL LIAB & FIRE INS CO,2005,1836067
8690,23825,NATIONAL PUBLIC FINANCE GUAR CORP,2005,12855
8691,22608,NATIONAL SPECIALTY INS CO,2005,15008022
8692,21881,NATIONAL SURETY CORP,2005,37657027
8693,19445,NATIONAL UNION FIRE INS CO OF PITTS,2005,461746281
8694,28223,NATIONWIDE AGRIBUSINESS INS CO,2005,132817
8695,10723,NATIONWIDE ASSUR CO,2005,7548855
8696,23760,NATIONWIDE GEN INS CO,2005,22094767
8697,25453,NATIONWIDE INS CO OF AMER,2005,25450680
8698,23779,NATIONWIDE MUT FIRE INS CO,2005,165016636
8699,23787,NATIONWIDE MUT INS CO,2005,263744875
8700,37877,NATIONWIDE PROP & CAS INS CO,2005,33024738
8701,42307,NAVIGATORS INS CO,2005,22159282
8702,15865,NCMIC INS CO,2005,6389179
8703,24171,NETHERLANDS INS CO THE,2005,41830271
8704,23841,NEW HAMPSHIRE INS CO,2005,260944478
8705,12122,NEW JERSEY MANUFACTURERS INS CO,2005,9486875
8706,12130,NEW SOUTH INS CO,2005,71691256
8707,14834,NEW YORK CENTRAL MUT FIRE INS CO,2005,478857778
8708,16608,NEW YORK MARINE & GEN INS CO,2005,42751816
8709,20690,NEW YORK MUNICIPAL INS RECIP,2005,49390172
8710,34843,NEW YORK SCHOOLS INS RECIP,2005,79891568
8711,10762,NEW YORK TRANSPORTATION INS CORP,2005,901770
8712,10967,Newport Mut Ins RRG Inc,2005,52601
8713,14788,NGM INS CO,2005,171257608
8714,27073,NIPPONKOA INS CO LTD US BR,2005,7384804
8715,23965,NORFOLK & DEDHAM MUT FIRE INS CO,2005,885582
8716,31470,NORGUARD INS CO,2005,12902885
8717,29700,NORTH AMER ELITE INS CO,2005,1452517
8718,29874,NORTH AMER SPECIALTY INS CO,2005,15511589
8719,43869,NORTH COUNTRY INS CO,2005,12327359
8720,24007,NORTH EAST INS CO,2005,1267225
8721,27740,NORTH POINTE INS CO,2005,87057
8722,21105,NORTH RIVER INS CO,2005,9127206
8723,38148,NORTH SEA INS CO,2005,6609028
8724,38369,NORTHERN ASSUR CO OF AMER,2005,11621262
8725,19372,NORTHERN INS CO OF NY,2005,4310765
8726,25992,NORTHERN SECURITY INS CO INC,2005,1581171
8727,24015,NORTHLAND INS CO,2005,12565948
8728,42552,NOVA CAS CO,2005,16277153
8729,24074,OHIO CAS INS CO,2005,31890374
8730,24104,OHIO FARMERS INS CO,2005,45779
8731,26565,OHIO IND CO,2005,5416042
8732,24139,OLD REPUBLIC GEN INS CORP,2005,6899
8733,24147,OLD REPUBLIC INS CO,2005,50289946
8734,37060,OLD UNITED CAS CO,2005,294147
8735,20621,ONEBEACON AMER INS CO,2005,74613676
8736,21970,ONEBEACON INS CO,2005,99945230
8737,22870,ONTARIO INS CO,2005,4149741
8738,44105,OPHTHALMIC MUT INS CO RRG,2005,195851
8739,30175,ORISKA INS CO,2005,10120267
8740,43850,OSWEGO CNTY MUT INS CO,2005,4986638
8741,30350,OTSEGO CO PATRONS COOP FIRE RELIEF,2005,1769847
8742,14915,OTSEGO MUT FIRE INS CO,2005,15657556
8743,20346,PACIFIC IND CO,2005,130947853
8744,37338,Pacific Ins Co,2005,19297
8745,37850,PACIFIC SPECIALTY INS CO,2005,559637
8746,10222,PACO ASSUR CO INC,2005,3456974
8747,40177,PARAMOUNT INS CO,2005,28973792
8748,23442,PATRIOT GEN INS CO,2005,795570
8749,18333,PEERLESS IND INS CO,2005,116893
8750,24198,PEERLESS INS CO,2005,93173345
8751,32859,PENN AMER INS CO,2005,88273
8752,14982,PENN MILLERS INS CO,2005,4709945
8753,21962,PENNSYLVANIA GEN INS CO,2005,6253789
8754,14974,PENNSYLVANIA LUMBERMENS MUT INS,2005,20430319
8755,12262,PENNSYLVANIA MANUFACTURERS ASSOC INS,2005,21693946
8756,41424,PENNSYLVANIA MANUFACTURERS IND CO,2005,6792919
8757,14990,PENNSYLVANIA NATL MUT CAS INS CO,2005,1704271
8758,12297,PETROLEUM CAS CO,2005,833643
8759,18058,PHILADELPHIA IND INS CO,2005,130042062
8760,25623,PHOENIX INS CO,2005,143451134
8761,41467,PHYSICIANS RECIP INSURERS,2005,294681586
8762,18619,PLATTE RIVER INS CO ,2005,8352630
8763,27251,PMI MORTGAGE INS CO,2005,38139250
8764,14460,PODIATRY INS CO OF AMER,2005,1136744
8765,37257,PRAETORIAN INS CO,2005,33197426
8766,15024,PREFERRED MUT INS CO,2005,119258126
8767,44083,PREFERRED PHYSICIANS MEDICAL RRG,2005,4927735
8768,36234,PREFERRED PROFESSIONAL INS CO,2005,2807259
8769,24260,PROGRESSIVE CAS INS CO,2005,6075096
8770,16322,PROGRESSIVE DIRECT INS CO,2005,83456754
8771,10042,Progressive Northeastern Ins Co,2005,707495233
8772,38628,PROGRESSIVE NORTHERN INS CO,2005,51049899
8773,42919,PROGRESSIVE NORTHWESTERN INS CO,2005,84113889
8774,32786,PROGRESSIVE SPECIALTY INS CO,2005,2953794
8775,34690,PROPERTY & CAS INS CO OF HARTFORD,2005,21402177
8776,12416,PROTECTIVE INS CO,2005,184025
8777,15040,PROVIDENCE MUT FIRE INS CO,2005,3795668
8778,24295,PROVIDENCE WASHINGTON INS CO,2005,2773093
8779,35726,Providence Washington Ins Co Of NY,2005,748833
8780,15059,PUBLIC SERV MUT INS CO,2005,54831258
8781,39217,QBE INS CORP,2005,48359664
8782,23752,QUANTA IND CO,2005,12215554
8783,15067,QUINCY MUT FIRE INS CO,2005,16243714
8784,36250,RADIAN ASSET ASSUR INC,2005,70636041
8785,33790,RADIAN GUAR INC,2005,48886048
8786,37303,Redland Ins Co,2005,1267427
8787,24449,REGENT INS CO,2005,2570022
8788,12475,REPUBLIC FRANKLIN INS CO,2005,76711431
8789,31275,REPUBLIC MORTGAGE INS OF NC,2005,11635785
8790,31089,REPWEST INS CO,2005,1079893
8791,10290,Response Ind Co Of DE,2005,7530043
8792,43044,RESPONSE INS CO,2005,10559968
8793,20133,RESPONSE WORLDWIDE DIRECT AUTO INS C,2005,4292481
8794,26050,RESPONSE WORLDWIDE INS CO,2005,17997717
8795,28860,RLI IND CO,2005,3189287
8796,13056,RLI INS CO,2005,53230511
8797,12491,ROCHDALE INS CO OF NY ,2005,22292917
8798,22314,RSUI IND CO,2005,38275177
8799,41378,RUTGERS CAS INS CO,2005,15083934
8800,10344,RVI AMER INS CO,2005,441898
8801,24740,SAFECO INS CO OF AMER,2005,29853360
8802,11215,SAFECO INS CO OF IN,2005,27147457
8803,24759,SAFECO NATL INS CO,2005,1921416
8804,15105,SAFETY NATL CAS CORP,2005,23733439
8805,38300,SAMSUNG FIRE & MARINE INS CO LTD,2005,12016666
8806,15580,SCOTTSDALE IND CO,2005,1236526
8807,22535,Seaboard Surety Co,2005,6274134
8808,24902,SECURITY INS CO OF HARTFORD,2005,309291
8809,15113,SECURITY MUT INS CO,2005,36293850
8810,12572,SELECTIVE INS CO OF AMER,2005,66906375
8811,13730,SELECTIVE INS CO OF NY,2005,24739142
8812,19259,SELECTIVE INS CO OF SC,2005,2151049
8813,26301,SELECTIVE WAY INS CO,2005,78549045
8814,10936,SENECA INS CO INC,2005,44161095
8815,11000,SENTINEL INS CO LTD,2005,40311230
8816,24988,SENTRY INS A MUT CO,2005,14124689
8817,21180,SENTRY SELECT INS CO,2005,7928950
8818,30503,Shelby Cas Ins Comp,2005,9528001
8819,11126,SOMPO JAPAN INS CO OF AMER,2005,27586665
8820,20613,SPARTA INS CO,2005,21694
8821,11622,SPECIALTY SURPLUS INS CO,2005,10539
8822,11114,ST CHARLES INS CO RRG,2005,101350
8823,24767,ST PAUL FIRE & MARINE INS CO,2005,160465884
8824,24775,ST PAUL GUARDIAN INS CO,2005,2179187
8825,24791,ST PAUL MERCURY INS CO,2005,65225607
8826,19224,ST PAUL PROTECTIVE INS CO,2005,20536
8827,19070,STANDARD FIRE INS CO,2005,45625075
8828,18023,STAR INS CO,2005,1875808
8829,40045,STARNET INS CO,2005,12419846
8830,25143,STATE FARM FIRE & CAS CO,2005,747205361
8831,25151,STATE FARM GEN INS CO,2005,1200
8832,25178,STATE FARM MUT AUTO INS CO,2005,982947536
8833,36102,STATE INS FUND,2005,1596553305
8834,36103,STATE INS FUND DISABILITY BENEFITS,2005,16784128
8835,12831,STATE NATL INS CO INC,2005,23356994
8836,25275,STATE WIDE INS CO,2005,41207916
8837,15210,STERLING INS CO,2005,47474051
8838,10952,STONEBRIDGE CAS INS CO,2005,8971672
8839,10340,STONINGTON INS CO,2005,7164840
8840,11024,STRATHMORE INS CO,2005,4580430
8841,24047,SURETY BONDING CO OF AMER,2005,231209
8842,20311,SYNCORA GUAR INC,2005,55709510
8843,12866,T H E INS CO,2005,5058396
8844,42376,TECHNOLOGY INS CO INC,2005,1785108
8845,23280,THE CINCINNATI IND CO,2005,189642
8846,28240,THE SERV INS CO INC,2005,346118
8847,13242,TITAN IND CO,2005,5812
8848,12904,TOKIO MARINE & NICHIDO FIRE INS CO,2005,38358022
8849,44300,TOWER INS CO OF NY,2005,298594800
8850,41238,TRANS PACIFIC INS CO,2005,641944
8851,20486,TRANSCONTINENTAL INS CO,2005,37401631
8852,28886,TRANSGUARD INS CO OF AMER INC,2005,5845499
8853,20494,TRANSPORTATION INS CO,2005,30036927
8854,28188,TRAVCO INS CO,2005,120801344
8855,19038,TRAVELERS CAS & SURETY CO,2005,38842206
8856,31194,TRAVELERS CAS & SURETY CO OF AMER,2005,72213883
8857,36170,TRAVELERS CAS CO OF CT,2005,12123781
8858,36137,TRAVELERS COMMERCIAL INS CO,2005,110993
8859,27998,TRAVELERS HOME & MARINE INS CO,2005,849447
8860,25658,TRAVELERS IND CO,2005,187583075
8861,25666,TRAVELERS IND CO OF AMER,2005,102406783
8862,25682,TRAVELERS IND CO OF CT,2005,129995673
8863,25674,TRAVELERS PROP CAS CO OF AMER,2005,425902565
8864,36161,TRAVELERS PROP CAS INS CO,2005,9601133
8865,23060,TRI STATE CONSUMER INS CO,2005,25221931
8866,24350,TRIAD GUAR INS CORP,2005,4517
8867,41211,TRITON INS CO,2005,209046
8868,21709,TRUCK INS EXCH,2005,4026912
8869,27120,TRUMBULL INS CO,2005,16456368
8870,37982,Tudor Ins Co,2005,15763952
8871,29459,TWIN CITY FIRE INS CO CO,2005,258948042
8872,37893,ULLICO CAS CO,2005,699242
8873,41050,UNDERWRITER FOR THE PROFESSIONS INS ,2005,25880
8874,25747,UNIGARD INS CO,2005,8021
8875,25844,UNION INS CO,2005,44547
8876,36226,UNITED CAS & SURETY INS CO,2005,400415
8877,11770,UNITED FINANCIAL CAS CO,2005,34996335
8878,13021,UNITED FIRE & CAS CO,2005,4467
8879,16250,UNITED FRONTIER MUT INS CO,2005,4046870
8880,40525,UNITED GUAR CREDIT INS CO,2005,364642
8881,26999,UNITED GUAR MORTGAGE IND CO,2005,5401756
8882,15873,UNITED GUAR RESIDENTIAL INS CO,2005,23891621
8883,41335,UNITED NATL SPECIALTY INS CO,2005,39206065
8884,25941,UNITED SERV AUTOMOBILE ASSN,2005,148879168
8885,25887,UNITED STATES FIDELITY & GUAR CO,2005,41928399
8886,21113,UNITED STATES FIRE INS CO,2005,45592231
8887,25895,UNITED STATES LIAB INS CO,2005,14420277
8888,10881,UNITRIN ADVANTAGE INS CO,2005,6682590
8889,16063,UNITRIN AUTO & HOME INS CO,2005,80066686
8890,10226,UNITRIN DIRECT INS CO,2005,11722115
8891,10915,UNITRIN DIRECT PROP & CAS CO,2005,7084563
8892,25909,UNITRIN PREFERRED INS CO,2005,82089879
8893,14770,Universal Bonding Ins Co,2005,193899
8894,13200,UNIVERSAL SURETY OF AMER,2005,621
8895,41181,UNIVERSAL UNDERWRITERS INS CO,2005,76738515
8896,29599,US SPECIALTY INS CO,2005,56678218
8897,25968,USAA CAS INS CO,2005,117473719
8898,18600,USAA GEN IND CO,2005,13447225
8899,28497,USPLATE GLASS INS CO,2005,338737
8900,15326,UTICA FIRST INS CO,2005,77931195
8901,25976,UTICA MUT INS CO,2005,102681642
8902,10687,UTICA NATL ASSUR CO,2005,16153371
8903,43478,UTICA NATL INS CO OF TX,2005,802252
8904,37273,AXIS INS CO,2005,38519
8905,33022,AXA INS CO,2005,7625677
8906,26611,VALIANT INS CO,2005,49236
8907,20508,VALLEY FORGE INS CO,2005,44948831
8908,21172,VANLINER INS CO,2005,7725179
8909,10815,VERLAN FIRE INS CO MD,2005,1042435
8910,26018,VERMONT MUT INS CO,2005,9894230
8911,14265,INDIANA LUMBERMENS MUT INS CO,2004,14796
8912,34789,21ST CENTURY CENTENNIAL INS CO,2004,17818714
8913,32220,21ST CENTURY N AMER INS CO,2004,46617697
8914,36587,21ST CENTURY NATL INS CO ,2004,8171081
8915,22225,21ST CENTURY PREFERRED INS CO,2004,7550642
8916,20796,21ST CENTURY PREMIER INS CO,2004,17479367
8917,23833,21ST CENTURY SECURITY INS CO,2004,5137622
8918,11105,A CENTRAL INS CO,2004,12525233
8919,22896,ACA FIN GUAR CORP,2004,10624922
8920,42544,ACADEMIC HLTH PROFESSIONALS INS ,2004,17803077
8921,31325,ACADIA INS CO,2004,9751564
8922,26379,ACCREDITED SURETY & CAS CO INC,2004,99531
8923,22667,ACE AMER INS CO,2004,255441676
8924,20702,ACE FIRE UNDERWRITERS INS CO,2004,9214508
8925,20699,ACE PROP & CAS INS CO,2004,12707698
8926,19984,ACIG INS CO,2004,780884
8927,22950,ACSTAR INS CO,2004,1897711
8928,44318,ADMIRAL IND CO,2004,50843553
8929,33898,AEGIS SECURITY INS CO,2004,2473924
8930,36153,AETNA INS CO OF CT,2004,77155238
8931,10014,AFFILIATED FM INS CO,2004,41272744
8932,22837,AGCS MARINE INS CO,2004,34354792
8933,42757,AGRI GEN INS CO,2004,924480
8934,34886,AIOI NISSAY DOWA INS CO OF AMER,2004,1289534
8935,19399,AIU INS CO,2004,112157678
8936,24899,ALEA NORTH AMERICA INS CO,2004,160835940
8937,20222,ALL AMER INS CO,2004,1585825
8938,30970,ALLEGANY CO-OP INS CO,2004,10420139
8939,13285,ALLEGHENY CAS CO,2004,196622
8940,35300,ALLIANZ GLOBAL RISKS US INS CO,2004,39425623
8941,22730,ALLIED WORLD REINS CO,2004,3293957
8942,19240,ALLSTATE IND CO,2004,329533988
8943,19232,ALLSTATE INS CO,2004,2231783101
8944,37907,ALLSTATE VEHICLE & PROP INS CO,2004,2778034
8945,10829,ALTERRA REINS USA INC,2004,994651
8946,18708,AMBAC ASSUR CORP,2004,201524446
8947,19720,AMERICAN ALT INS CORP,2004,55756140
8948,21849,AMERICAN AUTOMOBILE INS CO,2004,31437246
8949,10111,AMERICAN BANKERS INS CO OF FL,2004,18514995
8950,20427,AMERICAN CAS CO OF READING PA,2004,35865096
8951,12300,AMERICAN CONTRACTORS INS CO RRG,2004,88980
8952,38237,AMERICAN COUNTRY INS CO,2004,4724
8953,19690,AMERICAN ECONOMY INS CO,2004,12968842
8954,23337,AMERICAN EUROPEAN INS CO,2004,36065267
8955,23450,AMERICAN FAMILY HOME INS CO,2004,1567991
8956,44202,AMERICAN FEED INDUSTRY INS CO RRG,2004,36878
8957,24066,AMERICAN FIRE & CAS CO,2004,3369185
8958,40398,AMERICAN FUJI FIRE & MARINE INS CO,2004,52578
8959,26247,AMERICAN GUAR & LIAB INS,2004,95045821
8960,19380,AMERICAN HOME ASSUR CO,2004,432273997
8961,21857,AMERICAN INS CO,2004,59878533
8962,30562,AMERICAN MANUFACTURERS MUT INS CO,2004,2761966
8963,23469,AMERICAN MODERN HOME INS CO,2004,25050308
8964,12190,AMERICAN PET INS CO,2004,517592
8965,19615,AMERICAN RELIABLE INS CO,2004,20032421
8966,19631,AMERICAN ROAD INS CO,2004,7756511
8967,39969,AMERICAN SAFETY CAS INS CO,2004,12500655
8968,42978,AMERICAN SECURITY INS CO,2004,29672975
8969,17965,AMERICAN SENTINEL INS CO,2004,81264
8970,19704,AMERICAN STATES INS CO,2004,39778082
8971,13366,AMERICAN STEAMSHIP OWNERS MUT PROT,2004,164245583
8972,16616,AMERICAN TRANSIT INS CO,2004,257665853
8973,40142,AMERICAN ZURICH INS CO,2004,34827787
8974,19488,AMERISURE INS CO,2004,37301
8975,23396,AMERISURE MUT INS CO,2004,412445
8976,27928,AMEX ASSUR CO,2004,61632315
8977,42390,AMGUARD INS CO,2004,388126
8978,19976,AMICA MUT INS CO,2004,155627810
8979,11150,ARCH INS CO,2004,146503033
8980,10348,ARCH REINS CO,2004,143204
8981,19801,ARGONAUT INS CO,2004,18825460
8982,19828,ARGONAUT MIDWEST INS CO,2004,1176450
8983,41459,ARMED FORCES INS EXCH,2004,720497
8984,24678,ARROWOOD IND CO,2004,3719010
8985,43460,ASPEN AMER INS CO,2004,70981
8986,21865,ASSOCIATED IND CORP,2004,26427451
8987,16489,ASSOCIATED MUT INS CO,2004,11112945
8988,19305,ASSURANCE CO OF AMER,2004,14531060
8989,30180,ASSURED GUAR CORP,2004,39773121
8990,18287,ASSURED GUAR MUNICIPAL CORP,2004,180049298
8991,17159,ATAIN SPECIALTY INS CO,2004,250766
8992,41769,ATHENA ASSUR CO,2004,2629020
8993,19895,Atlantic Mut Ins Co,2004,42153716
8994,27154,ATLANTIC SPECIALTY INS CO,2004,57050493
8995,22586,ATLANTIC STATES INS CO,2004,4462082
8996,10923,Autoglass Ins Co,2004,21278
8997,19062,AUTOMOBILE INS CO OF HARTFORD CT,2004,253221786
8998,34460,AUTOONE INS CO,2004,150532503
8999,34479,AUTOONE SELECT INS CO,2004,27115
9000,10367,AVEMCO INS CO,2004,22614474
9001,29530,AXA ART INS CORP,2004,7637249
9002,33022,AXA INS CO,2004,10609576
9003,37273,AXIS INS CO,2004,85641
9004,20370,AXIS REINS CO,2004,2385918
9005,24813,BALBOA INS CO,2004,14890949
9006,18538,BANCINSURE INC,2004,1059880
9007,18279,BANKERS STANDARD INS CO,2004,2589676
9008,19763,BAY STATE INS CO,2004,6054916
9009,38245,BCS INS CO,2004,13335468
9010,29580,BERKLEY REGIONAL INS CO,2004,1221752
9011,20095,BITUMINOUS CAS CORP,2004,21550
9012,40754,BLUE RIDGE IND CO,2004,12111633
9013,20761,Boston Old Colony Ins Co,2004,477
9014,13528,BROTHERHOOD MUT INS CO,2004,388836
9015,20788,Buckeye Union Ins Co,2004,274269
9016,43800,CALLICOON CO OPERATIVE INS CO,2004,5415002
9017,19771,CAMBRIDGE MUT FIRE INS CO,2004,20755335
9018,36340,CAMICO MUT INS CO,2004,2567708
9019,20877,Capital Markets Assur Corp,2004,5824117
9020,10510,CAROLINA CAS INS CO,2004,7989649
9021,40134,CASTLEPOINT NATL INS CO,2004,263396
9022,11255,CATERPILLAR INS CO,2004,3357878
9023,24503,CATLIN IND CO,2004,15444094
9024,19909,Centennial Ins Co,2004,21129925
9025,43826,CENTRAL CO OPERATIVE INS CO,2004,4914388
9026,20230,CENTRAL MUT INS CO,2004,18993231
9027,34274,CENTRAL STATES IND CO OF OMAHA,2004,5960163
9028,34649,CENTRE INS CO,2004,422244
9029,25615,CHARTER OAK FIRE INS CO,2004,186206792
9030,19402,CHARTIS PROP CAS CO,2004,6246592
9031,10372,CHAUTAUQUA PATRONS INS ASSOC,2004,8460897
9032,29670,CHERRY VALLEY COOP INS CO,2004,226819
9033,22810,CHICAGO INS CO,2004,13780576
9034,12777,CHUBB IND INS CO,2004,148636072
9035,10669,CHURCH INS CO,2004,4698251
9036,18767,CHURCH MUT INS CO,2004,18251160
9037,25771,CIFG ASSUR N AMER INC,2004,33338664
9038,22004,CIM INS CORP,2004,31662778
9039,28665,CINCINNATI CAS CO,2004,767835
9040,10677,CINCINNATI INS CO,2004,33466609
9041,31534,CITIZENS INS CO OF AMER,2004,46629705
9042,20532,CLARENDON NATL INS CO,2004,85781396
9043,40266,CMG MORTGAGE INS CO,2004,2405484
9044,31887,COFACE N AMER INS CO,2004,1748246
9045,34347,COLONIAL AMER CAS & SURETY CO,2004,1069310
9046,13633,Colonial Coop Ins Co,2004,6124580
9047,28991,COLONIAL IND INS CO,2004,116214
9048,10758,COLONIAL SURETY CO,2004,2603441
9049,19410,COMMERCE & INDUSTRY INS CO,2004,81658123
9050,10220,COMMONWEALTH INS CO OF AMER,2004,752387
9051,10025,COMMUNITY MUT INS CO,2004,5298322
9052,34711,COMPUTER INS CO,2004,805944
9053,32190,CONSTITUTION INS CO,2004,20571
9054,20443,CONTINENTAL CAS CO,2004,379521814
9055,35289,CONTINENTAL INS CO,2004,90281534
9056,37206,CONTRACTORS BONDING & INS CO,2004,33476
9057,21318,COREGIS INS CO,2004,1014249
9058,10499,COREPOINTE INS CO,2004,6479112
9059,10022,COUNTRYWAY INS CO,2004,9667753
9060,10839,COUNTRYWIDE INS CO,2004,75230639
9061,31348,CRUM & FORSTER IND CO,2004,5336815
9062,10847,CUMIS INS SOCIETY INC,2004,17799946
9063,21164,DAIRYLAND INS CO,2004,4270518
9064,12718,DEVELOPERS SURETY & IND CO,2004,356767
9065,42048,DIAMOND STATE INS CO,2004,10573235
9066,36463,DISCOVER PROP & CAS INS CO,2004,45695887
9067,10645,DRIVERS INS CO,2004,3167534
9068,13919,DRYDEN MUT INS CO,2004,35186899
9069,43320,EASTERN MUT INS CO,2004,6584397
9070,14702,EASTGUARD INS CO,2004,284
9071,40649,ECONOMY PREMIER ASSUR CO,2004,67836623
9072,21261,ELECTRIC INS CO,2004,47165920
9073,21326,EMPIRE FIRE & MARINE INS CO,2004,14920947
9074,21350,EMPIRE INS CO,2004,1627939
9075,20648,EMPLOYERS FIRE INS CO,2004,4581198
9076,21458,EMPLOYERS INS  OF WAUSAU,2004,47950201
9077,21415,EMPLOYERS MUT CAS CO,2004,340154
9078,11252,ENCOMPASS HOME & AUTO INS CO,2004,254914
9079,15130,ENCOMPASS IND CO,2004,31293617
9080,11251,ENCOMPASS INDEPENDENT INS CO,2004,1453548
9081,10071,ENCOMPASS INS CO OF AMER,2004,46922858
9082,10072,ENCOMPASS PROP & CAS CO,2004,12464830
9083,10374,ERIE & NIAGRA INS ASSOC,2004,44324552
9084,26263,ERIE INS CO,2004,144062967
9085,16233,ERIE INS CO OF NY,2004,8430563
9086,37915,ESSENTIA INS CO,2004,7623
9087,25712,ESURANCE INS CO,2004,7928395
9088,20516,EULER HERMES AMER CREDIT IND CO,2004,13035730
9089,11037,EVEREADY INS CO,2004,21020811
9090,10120,EVEREST NATL INS CO ,2004,24808965
9091,12750,EVERGREEN NATL IND CO,2004,592723
9092,11045,EXCELSIOR INS CO,2004,59793040
9093,25917,EXECUTIVE INS CO,2004,2059923
9094,35181,EXECUTIVE RISK IND INC,2004,58011422
9095,21482,FACTORY MUT INS CO,2004,85529448
9096,44784,FAIRFIELD INS CO,2004,180963
9097,24384,FAIRMONT SPECIALTY INS CO,2004,2611054
9098,13803,FARM FAMILY CAS INS CO,2004,145879021
9099,11061,FARMERS FIRE INS CO,2004,1450797
9100,10806,FARMERS NEW CENTURY INS CO,2004,72773060
9101,41483,FARMINGTON CAS CO,2004,61362518
9102,20281,FEDERAL INS CO,2004,581242484
9103,13935,FEDERATED MUT INS CO,2004,15037216
9104,35270,Fidelity & Cas Co Of NY ,2004,11508107
9105,39306,FIDELITY & DEPOSIT CO OF MD ,2004,47594093
9106,35386,FIDELITY & GUAR INS CO,2004,15828903
9107,25879,FIDELITY & GUAR INS UNDERWRITERS INC,2004,11987936
9108,25180,FIDELITY NATL INS CO,2004,6492941
9109,16578,FIDELITY NATL PROP & CAS INS CO,2004,3214511
9110,12815,FINANCIAL GUAR INS CO,2004,62594681
9111,43842,FINGER LAKES FIRE & CAS INS CO,2004,7547019
9112,37400,FIRE DISTRICTS OF NY MUT INS CO INC,2004,12776558
9113,21873,FIREMANS FUND INS CO,2004,185371928
9114,20850,Firemens Ins Co Of Newark NJ,2004,5703081
9115,21784,FIREMENS INS CO OF WASHINGTON DC,2004,11077615
9116,34525,FIRST AMER SPECILATY INS CO,2004,348
9117,33588,FIRST LIBERTY INS CORP,2004,14602260
9118,24724,FIRST NATL INS CO OF AMER,2004,6236774
9119,28519,First Sealord Surety Inc,2004,1120149
9120,33278,FLORISTS INS CO,2004,432210
9121,13978,FLORISTS MUT INS CO,2004,2788258
