index,NAIC Code ,Company Name ,Calendar Year ,Net Premiums Written
5785,19305,ASSURANCE CO OF AMER,2009,9145539
5786,30180,ASSURED GUAR CORP,2009,212151787
5787,18287,ASSURED GUAR MUNICIPAL CORP,2009,135421026
5788,41769,ATHENA ASSUR CO,2009,91919
5789,19895,Atlantic Mut Ins Co,2009,381832
5790,27154,ATLANTIC SPECIALTY INS CO,2009,163618
5791,22586,ATLANTIC STATES INS CO,2009,1042954
5792,25422,ATRADIUS TRADE CREDIT INS CO,2009,4449523
5793,19062,AUTOMOBILE INS CO OF HARTFORD CT,2009,260411855
5794,34460,AUTOONE INS CO,2009,44535358
5795,34479,AUTOONE SELECT INS CO,2009,9555808
5796,10367,AVEMCO INS CO,2009,2338146
5797,29530,AXA ART INS CORP,2009,14369112
5798,33022,AXA INS CO,2009,12423336
5799,37273,AXIS INS CO,2009,68729368
5800,20370,AXIS REINS CO,2009,5836360
5801,24813,BALBOA INS CO,2009,17430916
5802,18538,BANCINSURE INC,2009,453204
5803,18279,BANKERS STANDARD INS CO,2009,47971112
5804,19763,BAY STATE INS CO,2009,6804131
5805,37540,BEAZLEY INS CO INC,2009,15138036
5806,32603,BERKLEY INS CO,2009,1379660
5807,29580,BERKLEY REGIONAL INS CO,2009,6110778
5808,13070,BERKSHIRE HATHAWAY ASSUR CORP,2009,18862526
5809,20095,BITUMINOUS CAS CORP,2009,121005
5810,20109,BITUMINOUS FIRE & MARINE INS CO,2009,10720
5811,40754,BLUE RIDGE IND CO,2009,4420143
5812,10371,BROOME CO OPERATIVE INS CO,2009,5795157
5813,13528,BROTHERHOOD MUT INS CO,2009,1021527
5814,23620,BURLINGTON INS CO,2009,20333660
5815,43800,CALLICOON CO OPERATIVE INS CO,2009,5989345
5816,19771,CAMBRIDGE MUT FIRE INS CO,2009,25585692
5817,21946,CAMDEN FIRE INS ASSOC,2009,6588
5818,36340,CAMICO MUT INS CO,2009,2470828
5819,12260,CAMPMED CAS & IND CO INC  ,2009,625826
5820,20877,Capital Markets Assur Corp,2009,45472
5821,10472,CAPITOL IND CORP,2009,1068153
5822,10510,CAROLINA CAS INS CO,2009,5229650
5823,17205,CASTLEPOINT INS CO,2009,160295957
5824,40134,CASTLEPOINT NATL INS CO,2009,2203708
5825,11255,CATERPILLAR INS CO,2009,1628686
5826,24503,CATLIN IND CO,2009,396590
5827,19518,CATLIN INS CO,2009,16937588
5828,19909,Centennial Ins Co,2009,80707
5829,43826,CENTRAL CO OPERATIVE INS CO,2009,5419353
5830,20230,CENTRAL MUT INS CO,2009,16939090
5831,34274,CENTRAL STATES IND CO OF OMAHA,2009,3313790
5832,25615,CHARTER OAK FIRE INS CO,2009,199533354
5833,19402,CHARTIS PROP CAS CO,2009,25054211
5834,10372,CHAUTAUQUA PATRONS INS ASSOC,2009,8046245
5835,10642,CHEROKEE INS CO,2009,310381
5836,29670,CHERRY VALLEY COOP INS CO,2009,258996
5837,22810,CHICAGO INS CO,2009,28151972
5838,12777,CHUBB IND INS CO,2009,161571183
5839,10052,CHUBB NATL INS CO,2009,3305153
5840,18767,CHURCH MUT INS CO,2009,19967268
5841,25771,CIFG ASSUR N AMER INC,2009,25805611
5842,22004,CIM INS CORP,2009,3388760
5843,28665,CINCINNATI CAS CO,2009,543178
5844,10677,CINCINNATI INS CO,2009,58169462
5845,31534,CITIZENS INS CO OF AMER,2009,61589478
5846,33480,CLERMONT INS CO,2009,5046153
5847,29114,CMG MORTGAGE ASSUR CO,2009,248
5848,40266,CMG MORTGAGE INS CO,2009,3319726
5849,31887,COFACE N AMER INS CO,2009,14619042
5850,34347,COLONIAL AMER CAS & SURETY CO,2009,753806
5851,10758,COLONIAL SURETY CO,2009,7414078
5852,19410,COMMERCE & INDUSTRY INS CO,2009,103986270
5853,10220,COMMONWEALTH INS CO OF AMER,2009,885147
5854,10025,COMMUNITY MUT INS CO,2009,3869601
5855,34711,COMPUTER INS CO,2009,597166
5856,20443,CONTINENTAL CAS CO,2009,310160970
5857,28258,CONTINENTAL IND CO,2009,8815718
5858,35289,CONTINENTAL INS CO,2009,22894241
5859,10804,CONTINENTAL WESTERN INS CO,2009,10778130
5860,37206,CONTRACTORS BONDING & INS CO,2009,238116
5861,10499,COREPOINTE INS CO,2009,1412920
5862,10022,COUNTRYWAY INS CO,2009,10844658
5863,10839,COUNTRYWIDE INS CO,2009,91793886
5864,26492,COURTESY INS CO,2009,15981
5865,31348,CRUM & FORSTER IND CO,2009,165304
5866,10847,CUMIS INS SOCIETY INC,2009,19269378
5867,21164,DAIRYLAND INS CO,2009,2908063
5868,16624,DARWIN NATL ASSUR CO,2009,17492998
5869,16705,DEALERS ASSUR CO,2009,7169476
5870,37184,DEERFIELD INS CO,2009,734
5871,12718,DEVELOPERS SURETY & IND CO,2009,559629
5872,42048,DIAMOND STATE INS CO,2009,2768512
5873,36463,DISCOVER PROP & CAS INS CO,2009,16988713
5874,10645,DRIVERS INS CO,2009,3527446
5875,13919,DRYDEN MUT INS CO,2009,41691284
5876,10724,EASTERN ALLIANCE INS CO,2009,40194
5877,43320,EASTERN MUT INS CO,2009,7099124
5878,14702,EASTGUARD INS CO,2009,757564
5879,40649,ECONOMY PREMIER ASSUR CO,2009,43534831
5880,21261,ELECTRIC INS CO,2009,44498598
5881,21326,EMPIRE FIRE & MARINE INS CO,2009,41837396
5882,21350,EMPIRE INS CO,2009,6652
5883,20648,EMPLOYERS FIRE INS CO,2009,51492391
5884,21458,EMPLOYERS INS  OF WAUSAU,2009,27064764
5885,21415,EMPLOYERS MUT CAS CO,2009,433569
5886,11252,ENCOMPASS HOME & AUTO INS CO,2009,9481216
5887,15130,ENCOMPASS IND CO,2009,59641434
5888,11251,ENCOMPASS INDEPENDENT INS CO,2009,617854
5889,10071,ENCOMPASS INS CO OF AMER,2009,60580461
5890,10072,ENCOMPASS PROP & CAS CO,2009,17377103
5891,10641,ENDURANCE AMER INS CO,2009,20765637
5892,11551,ENDURANCE REINS CORP OF AMER,2009,1058480
5893,10374,ERIE & NIAGRA INS ASSOC,2009,51163346
5894,26263,ERIE INS CO,2009,167924154
5895,16233,ERIE INS CO OF NY,2009,4728833
5896,26830,ERIE INS PROP & CAS CO,2009,879401
5897,37915,ESSENTIA INS CO,2009,12074881
5898,25712,ESURANCE INS CO,2009,57654649
5899,20516,EULER HERMES AMER CREDIT IND CO,2009,17767234
5900,35378,EVANSTON INS CO,2009,32055297
5901,11037,EVEREADY INS CO,2009,14007741
5902,10120,EVEREST NATL INS CO ,2009,114169176
5903,12750,EVERGREEN NATL IND CO,2009,3083315
5904,11045,EXCELSIOR INS CO,2009,66028169
5905,25917,EXECUTIVE INS CO,2009,13023
5906,35181,EXECUTIVE RISK IND INC,2009,38901292
5907,21482,FACTORY MUT INS CO,2009,92257425
5908,24384,FAIRMONT SPECIALTY INS CO,2009,2
5909,13803,FARM FAMILY CAS INS CO,2009,137017330
5910,10806,FARMERS NEW CENTURY INS CO,2009,38165381
5911,41483,FARMINGTON CAS CO,2009,103927935
5912,13608,FDM PREFERRED INS CO INC,2009,2020005
5913,20281,FEDERAL INS CO,2009,509898030
5914,13935,FEDERATED MUT INS CO,2009,14435326
5915,28304,FEDERATED SERV INS CO,2009,492485
5916,39306,FIDELITY & DEPOSIT CO OF MD ,2009,53857322
5917,35386,FIDELITY & GUAR INS CO,2009,4946310
5918,25879,FIDELITY & GUAR INS UNDERWRITERS INC,2009,3511996
5919,25180,FIDELITY NATL INS CO,2009,1765597
5920,16578,FIDELITY NATL PROP & CAS INS CO,2009,16022728
5921,88625,FIDUCIARY INS CO OF AMER,2009,37973612
5922,35009,FINANCIAL CAS & SURETY INC,2009,143093
5923,12815,FINANCIAL GUAR INS CO,2009,81828656
5924,43842,FINGER LAKES FIRE & CAS INS CO,2009,9494601
5925,13610,FIRE DISTRICTS INS CO INC,2009,1110487
5926,37400,FIRE DISTRICTS OF NY MUT INS CO INC,2009,14197494
5927,21873,FIREMANS FUND INS CO,2009,212641445
5928,21784,FIREMENS INS CO OF WASHINGTON DC,2009,1310991
5929,37710,FIRST AMER PROP & CAS INS CO,2009,32292
5930,34525,FIRST AMER SPECILATY INS CO,2009,88130
5931,11177,FIRST FIN INS CO,2009,25127
5932,33588,FIRST LIBERTY INS CORP,2009,145785253
5933,24724,FIRST NATL INS CO OF AMER,2009,7369020
5934,28519,First Sealord Surety Inc,2009,1706015
5935,35585,FLAGSHIP CITY INS CO,2009,439412
5936,13978,FLORISTS MUT INS CO,2009,4681420
5937,11185,FOREMOST INS CO GRAND RAPIDS MI,2009,34274401
5938,11800,FOREMOST PROP & CAS INS CO,2009,2850664
5939,10801,FORTRESS INS CO,2009,2997682
5940,26760,FULMONT MUT INS CO,2009,4939688
5941,21253,GARRISON PROP & CAS INS CO,2009,5514607
5942,28339,GATEWAY INS CO,2009,219723
5943,41491,GEICO CAS CO,2009,2871901
5944,35882,GEICO GEN INS CO,2009,1247771384
5945,22055,GEICO IND CO,2009,615756097
5946,24414,GENERAL CAS CO OF WI,2009,19853421
5947,30007,GENERAL FIDELITY INS CO,2009,1170400
5948,24732,GENERAL INS CO OF AMER,2009,21679871
5949,22039,GENERAL REINS CORP,2009,1796106
5950,20559,GENERAL SECURITY IND CO OF AZ,2009,10039973
5951,11967,GENERAL STAR NATL INS CO,2009,7548254
5952,11231,GENERALI US BRANCH,2009,700133
5953,10364,GENESEE PATRONS COOP INS CO,2009,4389161
5954,38962,GENESIS INS CO,2009,1446860
5955,38458,GENWORTH MORTGAGE INS CORP,2009,9282812
5956,18759,GENWORTH RESIDENTIAL MORTGAGE ASSUR ,2009,2324
5957,29823,GENWORTH RESIDENTIAL MORTGAGE INS CO,2009,36257234
5958,11092,GLOBAL LIBERTY INS CO OF NY,2009,31788540
5959,25569,GOTHAM INS CO,2009,129683
5960,22063,GOVERNMENT EMPLOYEES INS CO,2009,499808308
5961,23809,GRANITE STATE INS CO,2009,35504385
5962,25984,GRAPHIC ARTS MUT INS CO,2009,92511702
5963,36307,GRAY INS CO,2009,11956
5964,26832,GREAT AMER ALLIANCE INS CO,2009,4261464
5965,26344,GREAT AMER ASSUR CO,2009,36015361
5966,16691,GREAT AMER INS CO,2009,47090399
5967,22136,GREAT AMER INS CO OF NY,2009,43223197
5968,31135,GREAT AMER SECURITY INS CO,2009,5813503
5969,33723,GREAT AMER SPIRIT INS CO,2009,9187
5970,25224,GREAT DIVIDE INS CO,2009,17259109
5971,20303,GREAT NORTHERN INS CO,2009,347649767
5972,11371,GREAT WEST CAS CO,2009,51869
5973,22187,GREATER NY MUT INS CO,2009,92590805
5974,22322,GREENWICH INS CO,2009,62920483
5975,36650,GUARANTEE CO OF N AMER USA,2009,1380342
5976,11398,GUARANTEE INS CO,2009,11541581
5977,42803,GUIDEONE ELITE INS CO,2009,1023075
5978,15032,GUIDEONE MUT INS CO,2009,11816630
5979,14559,GUIDEONE SPECIALTY MUT INS CO,2009,6167192
5980,34037,HALLMARK INS CO,2009,372426
5981,22292,HANOVER INS CO,2009,77525441
5982,26433,HARCO NATL INS CO,2009,5203859
5983,33235,Harleysville Ins Co of NY ,2009,127313316
5984,26182,HARLEYSVILLE WORCESTER INS CO,2009,139435221
5985,22357,HARTFORD ACCIDENT & IND CO,2009,43684280
5986,29424,HARTFORD CAS INS CO,2009,86080818
5987,19682,HARTFORD FIRE IN CO,2009,192308296
5988,38288,HARTFORD INS CO OF IL,2009,79334300
5989,37478,HARTFORD INS CO OF THE MIDWEST,2009,128219037
5990,11452,HARTFORD STEAM BOIL INSPEC & INS CO,2009,6656276
5991,29890,HARTFORD STEAM BOIL INSPEC INS CO CT,2009,7922
5992,30104,HARTFORD UNDERWRITERS INS CO,2009,25834072
5993,41343,HDI GERLING AMER INS CO,2009,3808378
5994,12519,HEALTHCARE PROFESSIONAL INS CO INC,2009,30304827
5995,24309,HEREFORD INS CO,2009,75329866
5996,32077,HERITAGE CAS INS CO,2009,104147
5997,39527,HERITAGE IND CO,2009,5448917
5998,18376,HERMITAGE INS CO ,2009,48125418
5999,10200,HISCOX INS CO INC,2009,449020
6000,14206,HOLYOKE MUT INS CO IN SALEM,2009,217699
6001,10986,HOMESITE INS CO OF NY,2009,16870970
6002,22578,HORACE MANN INS CO,2009,355965
6003,30317,HOSPITALS INS CO INC,2009,153124259
6004,10069,HOUSING AUTHORITY PROP A MUT CO,2009,292222
6005,25054,HUDSON INS CO,2009,15813485
6006,37079,HUDSON SPECIALTY INS CO,2009,2053925
6007,29068,IDS PROP CAS INS CO,2009,24918191
6008,23817,ILLINOIS NATL INS CO,2009,165336704
6009,43575,INDEMNITY INS CO OF NORTH AMER,2009,58728413
6010,36940,INDIAN HARBOR INS CO,2009,45741463
6011,14265,INDIANA LUMBERMENS MUT INS CO,2009,727153
6012,39497,INFINITY ASSUR INS CO,2009,1028
6013,11738,INFINITY AUTO INS CO,2009,22746
6014,21792,INFINITY CAS INS CO,2009,64523
6015,22268,INFINITY INS CO,2009,1871058
6016,16802,INFINITY SAFEGUARD INS CO,2009,2124
6017,38873,INFINITY SECURITY INS CO,2009,274709
6018,20260,INFINITY SELECT INS CO,2009,154626
6019,31925,INFINITY SPECIALTY INS CO,2009,29945
6020,12599,INFINITY STANDARD INS CO,2009,2006579
6021,22195,INSURANCE CO OF GREATER NY,2009,23304800
6022,22713,INSURANCE CO OF N AMER,2009,6738561
6023,19429,INSURANCE CO OF THE STATE OF PA,2009,125222626
6024,27847,INSURANCE CO OF THE WEST,2009,100558
6025,27930,INTEGON CAS INS CO,2009,503284
6026,29742,INTEGON NATL INS CO,2009,13699116
6027,31488,INTEGON PREFERRED INS CO,2009,2258320
6028,14311,INTERBORO INS CO,2009,39921686
6029,34860,INTERNATIONAL CREDIT OF N AMER REINS,2009,754465
6030,11592,INTERNATIONAL FIDELITY INS CO,2009,9010897
6031,23647,IRONSHORE IND INC,2009,16267904
6032,14354,JEWELERS MUT INS CO,2009,14693563
6033,10914,KEMPER INDEPENDENCE INS CO,2009,74063459
6034,10088,KENSINGTON INS CO,2009,8565944
6035,13668,KINGSTONE INS CO,2009,26955318
6036,26077,LANCER INS CO,2009,39549237
6037,35637,LANDMARK INS CO,2009,3849851
6038,37800,LEADING INS GRP INS CO LTD,2009,26042477
6039,10380,LEATHERSTOCKING COOP INS  CO,2009,5904959
6040,37940,LEXINGTON NATL INS CORP,2009,602013
6041,42404,LIBERTY INS CORP,2009,151058984
6042,19917,LIBERTY INS UNDERWRITERS INC,2009,51973991
6043,23035,LIBERTY MUT FIRE INS CO,2009,746560282
6044,23043,LIBERTY MUT INS CO,2009,340425511
6045,33855,LINCOLN GEN INS CO,2009,35404323
6046,10748,LIVINGSTON MUT INS CO,2009,5413653
6047,33600,LM INS CORP,2009,15069050
6048,10982,Long Island Ins Co,2009,12062033
6049,27138,LUMBERMENS CAS INS CO,2009,31381
6050,22977,LUMBERMENS MUT CAS CO,2009,168731
6051,23108,LUMBERMENS UNDERWRITING ALLIANCE ,2009,928902
6052,30449,MADISON MUT INS CO,2009,3836265
6053,29939,MAIN ST AMER ASSUR CO,2009,45169961
6054,42269,MAJESTIC INS CO,2009,23234134
6055,36897,MANUFACTURERS ALLIANCE INS CO,2009,4318979
6056,28932,MARKEL AMER INS CO,2009,6329710
6057,38970,MARKEL INS CO,2009,24384532
6058,19356,MARYLAND CAS CO,2009,13492008
6059,22306,MASSACHUSETTS BAY INS CO,2009,50108346
6060,36030,MAYA ASSUR CO,2009,14748298
6061,12041,MBIA INS CORP,2009,264240931
6062,34231,MEDICAL LIAB MUT INS CO,2009,600211263
6063,22241,MEDMARC CAS INS CO,2009,712070
6064,11030,MEMIC IND CO,2009,6418649
6065,31968,MERASTAR INS CO,2009,861728
6066,14478,MERCER INS CO,2009,131951
6067,14494,MERCHANTS BONDING CO A MUT,2009,569206
6068,23329,MERCHANTS MUT INS CO,2009,79446258
6069,12901,MERCHANTS PREFERRED INS CO,2009,44066502
6070,11908,MERCURY CAS CO,2009,42268402
6071,24821,MERITPLAN INS CO,2009,42372099
6072,19798,MERRIMACK MUT FIRE INS CO,2009,43441633
6073,40169,METROPOLITAN CAS INS CO,2009,148721920
6074,39950,METROPOLITAN GEN INS CO,2009,759515
6075,34339,METROPOLITAN GRP PROP & CAS INS CO,2009,73411431
6076,26298,METROPOLITAN PROP & CAS INS CO,2009,127296897
6077,10682,MGIC CREDIT ASSUR CORP,2009,1601
6078,38601,MIC PROP & CAS INS CORP,2009,4040200
6079,14508,MICHIGAN MILLERS MUT INS CO,2009,10811157
6080,35866,MID HUDSON CO OPERATIVE INS CO,2009,6307578
6081,23434,MIDDLESEX INS CO,2009,9257
6082,14532,MIDDLESEX MUT ASSUR CO,2009,11564980
6083,26835,MIDROX INS CO,2009,3641532
6084,26818,MIDSTATE MUT INS CO,2009,12716276
6085,23612,MIDWEST EMPLOYERS CAS CO,2009,6796635
6086,20362,MITSUI SUMITOMO INS CO OF AMER,2009,28569548
6087,22551,MITSUI SUMITOMO INS USA INC,2009,5044760
6088,29858,MORTGAGE GUAR INS CORP,2009,47879189
6089,13331,MOTORISTS COMMERCIAL MUT INS CO,2009,4080482
6090,22012,MOTORS INS CORP,2009,1630374
6091,26522,MOUNT VERNON FIRE INS CO,2009,1222627
6092,10205,MOUNTAIN VALLEY IND CO,2009,4220869
6093,43001,NARRAGANSETT BAY INS CO,2009,9525364
6094,23663,NATIONAL AMER INS CO,2009,103751
6095,11991,NATIONAL CAS CO,2009,64529329
6096,10243,NATIONAL CONTINENTAL INS CO,2009,60502304
6097,15679,NATIONAL FIRE & IND EXCH,2009,355786
6098,20478,NATIONAL FIRE INS CO OF HARTFORD,2009,62532021
6099,42447,NATIONAL GEN ASSUR CO,2009,5901830
6100,23728,NATIONAL GEN INS CO,2009,6686004
6101,36072,NATIONAL GUARDIAN RRG INC,2009,23167
6102,44016,NATIONAL HOME INS CO RRG,2009,113819
6103,32620,NATIONAL INTERSTATE INS CO,2009,19938188
6104,20052,NATIONAL LIAB & FIRE INS CO,2009,10489005
6105,39004,NATIONAL MERIT INS CO,2009,4127065
6106,23825,NATIONAL PUBLIC FINANCE GUAR CORP,2009,4393
6107,22608,NATIONAL SPECIALTY INS CO,2009,15062298
6108,21881,NATIONAL SURETY CORP,2009,36971523
6109,19445,NATIONAL UNION FIRE INS CO OF PITTS,2009,613295837
6110,28223,NATIONWIDE AGRIBUSINESS INS CO,2009,1425615
6111,10723,NATIONWIDE ASSUR CO,2009,1424274
6112,23760,NATIONWIDE GEN INS CO,2009,31051237
6113,25453,NATIONWIDE INS CO OF AMER,2009,81001846
6114,23779,NATIONWIDE MUT FIRE INS CO,2009,156408335
6115,23787,NATIONWIDE MUT INS CO,2009,165300572
6116,37877,NATIONWIDE PROP & CAS INS CO,2009,58347978
6117,42307,NAVIGATORS INS CO,2009,49411221
6118,15865,NCMIC INS CO,2009,4448764
6119,24171,NETHERLANDS INS CO THE,2009,52351363
6120,23841,NEW HAMPSHIRE INS CO,2009,408259016
6121,12122,NEW JERSEY MANUFACTURERS INS CO,2009,5514284
6122,12130,NEW SOUTH INS CO,2009,112330395
6123,14834,NEW YORK CENTRAL MUT FIRE INS CO,2009,414676539
6124,16608,NEW YORK MARINE & GEN INS CO,2009,36469462
6125,20690,NEW YORK MUNICIPAL INS RECIP,2009,42347660
6126,34843,NEW YORK SCHOOLS INS RECIP,2009,78272484
6127,14788,NGM INS CO,2009,162974925
6128,27073,NIPPONKOA INS CO LTD US BR,2009,4838433
6129,23965,NORFOLK & DEDHAM MUT FIRE INS CO,2009,425990
6130,31470,NORGUARD INS CO,2009,15219097
6131,29700,NORTH AMER ELITE INS CO,2009,434645
6132,29874,NORTH AMER SPECIALTY INS CO,2009,22410494
6133,43869,NORTH COUNTRY INS CO,2009,8924945
6134,24007,NORTH EAST INS CO,2009,2964582
6135,27740,NORTH POINTE INS CO,2009,2420786
6136,21105,NORTH RIVER INS CO,2009,6696325
6137,38148,NORTH SEA INS CO,2009,4102298
6138,38369,NORTHERN ASSUR CO OF AMER,2009,10843324
6139,19372,NORTHERN INS CO OF NY,2009,4024174
6140,25992,NORTHERN SECURITY INS CO INC,2009,1758425
6141,24015,NORTHLAND INS CO,2009,11085277
6142,42552,NOVA CAS CO,2009,19023794
6143,23248,OCCIDENTAL FIRE & CAS CO OF NC,2009,1733106
6144,12360,OCEAN HARBOR CAS INS CO,2009,8169406
6145,24074,OHIO CAS INS CO,2009,15937583
6146,24104,OHIO FARMERS INS CO,2009,231620
6147,26565,OHIO IND CO,2009,3795209
6148,24082,OHIO SECURITY INS CO,2009,162816
6149,40231,OLD DOMINION INS CO,2009,4730064
6150,24139,OLD REPUBLIC GEN INS CORP,2009,26081253
6151,24147,OLD REPUBLIC INS CO,2009,70560444
6152,37060,OLD UNITED CAS CO,2009,505765
6153,20621,ONEBEACON AMER INS CO,2009,61820975
6154,21970,ONEBEACON INS CO,2009,9074362
6155,42650,ONEBEACON MIDWEST INS CO,2009,392447
6156,22870,ONTARIO INS CO,2009,4365945
6157,44105,OPHTHALMIC MUT INS CO RRG,2009,292837
6158,30175,ORISKA INS CO,2009,130747
6159,43850,OSWEGO CNTY MUT INS CO,2009,5752017
6160,30350,OTSEGO CO PATRONS COOP FIRE RELIEF,2009,1805333
6161,14915,OTSEGO MUT FIRE INS CO,2009,16930218
6162,22748,PACIFIC EMPLOYERS INS CO,2009,1087334
6163,20346,PACIFIC IND CO,2009,155188889
6164,37850,PACIFIC SPECIALTY INS CO,2009,425194
6165,10222,PACO ASSUR CO INC,2009,781988
6166,40177,PARAMOUNT INS CO,2009,23098797
6167,13049,PARK INS CO,2009,12118281
6168,23442,PATRIOT GEN INS CO,2009,617655
6169,18333,PEERLESS IND INS CO,2009,1079189
6170,24198,PEERLESS INS CO,2009,176825134
6171,14982,PENN MILLERS INS CO,2009,2947805
6172,21962,PENNSYLVANIA GEN INS CO,2009,456044
6173,14974,PENNSYLVANIA LUMBERMENS MUT INS,2009,23252434
6174,12262,PENNSYLVANIA MANUFACTURERS ASSOC INS,2009,23189309
6175,41424,PENNSYLVANIA MANUFACTURERS IND CO,2009,12584737
6176,14990,PENNSYLVANIA NATL MUT CAS INS CO,2009,1097103
6177,37648,PERMANENT GEN ASSUR CORP,2009,4123032
6178,12297,PETROLEUM CAS CO,2009,448605
6179,18058,PHILADELPHIA IND INS CO,2009,238477324
6180,25623,PHOENIX INS CO,2009,128327688
6181,41467,PHYSICIANS RECIP INSURERS,2009,405123892
6182,18619,PLATTE RIVER INS CO ,2009,2770582
6183,10287,PMI INS CO,2009,8372705
6184,27251,PMI MORTGAGE INS CO,2009,22270886
6185,14460,PODIATRY INS CO OF AMER,2009,9289792
6186,37257,PRAETORIAN INS CO,2009,63225383
6187,15024,PREFERRED MUT INS CO,2009,127864784
6188,44083,PREFERRED PHYSICIANS MEDICAL RRG,2009,8937975
6189,36234,PREFERRED PROFESSIONAL INS CO,2009,2070537
6190,15586,PRESERVER INS CO,2009,2533657
6191,12873,PRIVILEGE UNDERWRITERS RECP EXCH,2009,9340151
6192,21903,PROCENTURY INS CO,2009,74926
6193,11127,PROFESSIONAL SOLUTIONS INS CO,2009,32425
6194,25585,PROFESSIONALS DIRECT INS CO,2009,1523544
6195,11851,PROGRESSIVE ADVANCED INS CO,2009,36229362
6196,24260,PROGRESSIVE CAS INS CO,2009,29388403
6197,16322,PROGRESSIVE DIRECT INS CO,2009,106626359
6198,24279,PROGRESSIVE MAX INS CO,2009,21921947
6199,38628,PROGRESSIVE NORTHERN INS CO,2009,228416965
6200,42919,PROGRESSIVE NORTHWESTERN INS CO,2009,53756007
6201,37834,PROGRESSIVE PREFERRED INS CO,2009,116781677
6202,32786,PROGRESSIVE SPECIALTY INS CO,2009,46268520
6203,34690,PROPERTY & CAS INS CO OF HARTFORD,2009,41630376
6204,12416,PROTECTIVE INS CO,2009,3344021
6205,15040,PROVIDENCE MUT FIRE INS CO,2009,4895218
6206,24295,PROVIDENCE WASHINGTON INS CO,2009,3647
6207,15059,PUBLIC SERV MUT INS CO,2009,46195929
6208,39217,QBE INS CORP,2009,85393359
6209,15067,QUINCY MUT FIRE INS CO,2009,14711685
6210,36250,RADIAN ASSET ASSUR INC,2009,42290126
6211,33790,RADIAN GUAR INC,2009,35415448
6212,37303,Redland Ins Co,2009,8856812
6213,24449,REGENT INS CO,2009,5221991
6214,12475,REPUBLIC FRANKLIN INS CO,2009,60194256
6215,31275,REPUBLIC MORTGAGE INS OF NC,2009,13357678
6216,31089,REPWEST INS CO,2009,1131856
6217,43044,RESPONSE INS CO,2009,5774410
6218,20133,RESPONSE WORLDWIDE DIRECT AUTO INS C,2009,6609918
6219,26050,RESPONSE WORLDWIDE INS CO,2009,6617101
6220,13056,RLI INS CO,2009,61752374
6221,12491,ROCHDALE INS CO OF NY ,2009,66259058
6222,22314,RSUI IND CO,2009,36730948
6223,41378,RUTGERS CAS INS CO,2009,17076128
6224,10344,RVI AMER INS CO,2009,881539
6225,24740,SAFECO INS CO OF AMER,2009,42249962
6226,11215,SAFECO INS CO OF IN,2009,12787282
6227,24759,SAFECO NATL INS CO,2009,495865
6228,11123,SAFETY FIRST INS CO,2009,47842
6229,15105,SAFETY NATL CAS CORP,2009,24113160
6230,38300,SAMSUNG FIRE & MARINE INS CO LTD,2009,15515518
6231,10368,SAUQUOIT VALLEY INS CO,2009,996705
6232,15580,SCOTTSDALE IND CO,2009,14036952
6233,15563,SEABRIGHT INS CO,2009,936658
6234,15113,SECURITY MUT INS CO,2009,36719227
6235,12572,SELECTIVE INS CO OF AMER,2009,47948149
6236,13730,SELECTIVE INS CO OF NY,2009,25962126
6237,19259,SELECTIVE INS CO OF SC,2009,2640971
6238,26301,SELECTIVE WAY INS CO,2009,81793704
6239,10936,SENECA INS CO INC,2009,39933817
6240,11000,SENTINEL INS CO LTD,2009,140104077
6241,28460,SENTRY CAS CO,2009,321930
6242,24988,SENTRY INS A MUT CO,2009,12554888
6243,21180,SENTRY SELECT INS CO,2009,3867522
6244,11126,SOMPO JAPAN INS CO OF AMER,2009,22997281
6245,20613,SPARTA INS CO,2009,6096696
6246,11114,ST CHARLES INS CO RRG,2009,2065
6247,24767,ST PAUL FIRE & MARINE INS CO,2009,121588995
6248,24775,ST PAUL GUARDIAN INS CO,2009,5293487
6249,24791,ST PAUL MERCURY INS CO,2009,49740618
6250,19224,ST PAUL PROTECTIVE INS CO,2009,532289
6251,19070,STANDARD FIRE INS CO,2009,49280107
6252,18023,STAR INS CO,2009,10541321
6253,40045,STARNET INS CO,2009,22489256
6254,38318,STARR IND & LIAB CO,2009,26944681
6255,25143,STATE FARM FIRE & CAS CO,2009,985165862
6256,25151,STATE FARM GEN INS CO,2009,15717
6257,25178,STATE FARM MUT AUTO INS CO,2009,1048991582
6258,36102,STATE INS FUND,2009,1309601077
6259,36103,STATE INS FUND DISABILITY BENEFITS,2009,16593975
6260,12831,STATE NATL INS CO INC,2009,21336453
6261,25275,STATE WIDE INS CO,2009,37735957
6262,15210,STERLING INS CO,2009,47499243
6263,10952,STONEBRIDGE CAS INS CO,2009,10050594
6264,10340,STONINGTON INS CO,2009,14299901
6265,11024,STRATHMORE INS CO,2009,30362095
6266,10916,SURETEC INS CO,2009,13644
6267,24047,SURETY BONDING CO OF AMER,2009,266068
6268,13666,SYNCORA CAPITAL ASSUR INC,2009,33490402
6269,20311,SYNCORA GUAR INC,2009,42258493
6270,12866,T H E INS CO,2009,3859428
6271,42376,TECHNOLOGY INS CO INC,2009,90628882
6272,29513,THE BAR PLAN MUT INS CO ,2009,1468
6273,23280,THE CINCINNATI IND CO,2009,431279
6274,28240,THE SERV INS CO INC,2009,1238378
6275,25534,TIG INS CO,2009,13
6276,13242,TITAN IND CO,2009,527953
6277,10945,TM CAS INS CO,2009,6246
6278,12904,TOKIO MARINE & NICHIDO FIRE INS CO,2009,34188755
6279,44300,TOWER INS CO OF NY,2009,278695292
6280,43702,TOWER NATL INS CO,2009,54737278
6281,41238,TRANS PACIFIC INS CO,2009,1200715
6282,28886,TRANSGUARD INS CO OF AMER INC,2009,3916282
6283,20494,TRANSPORTATION INS CO,2009,24794582
6284,28188,TRAVCO INS CO,2009,118348152
6285,19038,TRAVELERS CAS & SURETY CO,2009,40116591
6286,31194,TRAVELERS CAS & SURETY CO OF AMER,2009,102997370
6287,36170,TRAVELERS CAS CO OF CT,2009,5626085
6288,19046,TRAVELERS CAS INS CO OF AMER,2009,25073704
6289,36137,TRAVELERS COMMERCIAL INS CO,2009,12198031
6290,27998,TRAVELERS HOME & MARINE INS CO,2009,142657993
6291,25658,TRAVELERS IND CO,2009,129038621
6292,25666,TRAVELERS IND CO OF AMER,2009,108033312
6293,25682,TRAVELERS IND CO OF CT,2009,111313228
6294,25674,TRAVELERS PROP CAS CO OF AMER,2009,383507785
6295,36161,TRAVELERS PROP CAS INS CO,2009,6123752
6296,23060,TRI STATE CONSUMER INS CO,2009,37081774
6297,24350,TRIAD GUAR INS CORP,2009,1160142
6298,41211,TRITON INS CO,2009,607136
6299,21709,TRUCK INS EXCH,2009,47118124
6300,27120,TRUMBULL INS CO,2009,20157681
6301,29459,TWIN CITY FIRE INS CO CO,2009,144746005
6302,37893,ULLICO CAS CO,2009,5484770
6303,25844,UNION INS CO,2009,6443179
6304,36226,UNITED CAS & SURETY INS CO,2009,233199
6305,11770,UNITED FINANCIAL CAS CO,2009,8888461
6306,16250,UNITED FRONTIER MUT INS CO,2009,3161836
6307,40525,UNITED GUAR CREDIT INS CO,2009,537238
6308,26999,UNITED GUAR MORTGAGE IND CO,2009,22670335
6309,15873,UNITED GUAR RESIDENTIAL INS CO,2009,8738871
6310,25941,UNITED SERV AUTOMOBILE ASSN,2009,157405644
6311,25887,UNITED STATES FIDELITY & GUAR CO,2009,3645174
6312,21113,UNITED STATES FIRE INS CO,2009,34558179
6313,25895,UNITED STATES LIAB INS CO,2009,16954616
6314,10881,UNITRIN ADVANTAGE INS CO,2009,5926541
6315,16063,UNITRIN AUTO & HOME INS CO,2009,54785448
6316,10226,UNITRIN DIRECT INS CO,2009,7829513
6317,10915,UNITRIN DIRECT PROP & CAS CO,2009,2320197
6318,25909,UNITRIN PREFERRED INS CO,2009,44025372
6319,32867,UNIVERSAL FIRE & CAS INS CO,2009,167316
6320,13200,UNIVERSAL SURETY OF AMER,2009,1050
6321,41181,UNIVERSAL UNDERWRITERS INS CO,2009,46222506
6322,29998,UPPER HUDSON NATL INS CO,2009,2568
6323,29599,US SPECIALTY INS CO,2009,145882186
6324,25968,USAA CAS INS CO,2009,129473836
6325,18600,USAA GEN IND CO,2009,18089780
6326,28497,USPLATE GLASS INS CO,2009,254725
6327,15326,UTICA FIRST INS CO,2009,70817236
6328,25976,UTICA MUT INS CO,2009,69387312
6329,10687,UTICA NATL ASSUR CO,2009,40972405
6330,43478,UTICA NATL INS CO OF TX,2009,20024399
6331,26611,VALIANT INS CO,2009,18823790
6332,20508,VALLEY FORGE INS CO,2009,51886265
6333,21172,VANLINER INS CO,2009,7430315
6334,10815,VERLAN FIRE INS CO MD,2009,813351
6335,26018,VERMONT MUT INS CO,2009,7482679
6336,10644,VICTORIA AUTOMOBILE INS CO,2009,60506
6337,42889,VICTORIA FIRE & CAS CO,2009,3298
6338,10105,VICTORIA SELECT INS CO,2009,59
6339,20397,VIGILANT INS CO,2009,174890382
6340,40827,VIRGINIA SURETY CO INC,2009,551744
